[
  {
    "relationship_id": "rel.program.governs.batch.qpcr.20260323.07",
    "relationship_type": "governs",
    "from_entity": {
      "entity_id": "program.gxp.assay",
      "entity_type": "lab_program"
    },
    "to_entity": {
      "entity_id": "batch.qpcr.20260323.07",
      "entity_type": "sample_batch"
    },
    "created_at": "2026-03-23T12:03:00Z",
    "version": 1
  },
  {
    "relationship_id": "rel.run.processes.batch.qpcr.20260323.07",
    "relationship_type": "processes",
    "from_entity": {
      "entity_id": "run.qpcr.20260323.07",
      "entity_type": "instrument_run"
    },
    "to_entity": {
      "entity_id": "batch.qpcr.20260323.07",
      "entity_type": "sample_batch"
    },
    "created_at": "2026-03-23T12:03:00Z",
    "version": 1
  },
  {
    "relationship_id": "rel.board.reviews.run.qpcr.20260323.07",
    "relationship_type": "reviews",
    "from_entity": {
      "entity_id": "board.quality.release",
      "entity_type": "quality_review_board"
    },
    "to_entity": {
      "entity_id": "run.qpcr.20260323.07",
      "entity_type": "instrument_run"
    },
    "created_at": "2026-03-23T12:03:00Z",
    "version": 1
  }
]
