{
  "relationship_id": "rel.supplier-beta.supplies.factory-acme-dallas",
  "relationship_type": "supplies",
  "from_entity": {
    "entity_id": "supplier.beta",
    "entity_type": "supplier"
  },
  "to_entity": {
    "entity_id": "factory.acme.dallas",
    "entity_type": "factory"
  },
  "attributes": {
    "material": "resin.grade-a",
    "contract_id": "contract.beta.acme.2026",
    "daily_capacity": 900
  },
  "metadata": {
    "source": "bootstrap_fixture",
    "adapter": "supply-network"
  },
  "tags": ["tier-1", "material-flow"],
  "effective_at": "2026-01-01T00:00:00Z",
  "created_at": "2026-03-08T10:00:00Z",
  "updated_at": "2026-03-08T10:00:00Z",
  "version": 1,
  "status": "active"
}
