[
  {
    "relationship_id": "rel.feed.updates.overlay.digital-twin.power-grid",
    "relationship_type": "updates",
    "from_entity": {
      "entity_id": "feed.digital-twin.metro-mesh",
      "entity_type": "dt_signal_feed"
    },
    "to_entity": {
      "entity_id": "overlay.digital-twin.power-grid",
      "entity_type": "dt_overlay_model"
    },
    "created_at": "2026-03-23T12:04:30Z",
    "version": 1
  },
  {
    "relationship_id": "rel.feed.updates.overlay.digital-twin.city-ops",
    "relationship_type": "updates",
    "from_entity": {
      "entity_id": "feed.digital-twin.metro-mesh",
      "entity_type": "dt_signal_feed"
    },
    "to_entity": {
      "entity_id": "overlay.digital-twin.city-ops",
      "entity_type": "dt_overlay_model"
    },
    "created_at": "2026-03-23T12:04:45Z",
    "version": 1
  },
  {
    "relationship_id": "rel.control.oversees.binding.digital-twin.power-grid",
    "relationship_type": "oversees",
    "from_entity": {
      "entity_id": "control.digital-twin.metro-watchfloor",
      "entity_type": "dt_control_center"
    },
    "to_entity": {
      "entity_id": "binding.digital-twin.power-grid.0001",
      "entity_type": "dt_host_binding"
    },
    "created_at": "2026-03-23T12:05:00Z",
    "version": 1
  },
  {
    "relationship_id": "rel.control.oversees.binding.digital-twin.city-ops",
    "relationship_type": "oversees",
    "from_entity": {
      "entity_id": "control.digital-twin.metro-watchfloor",
      "entity_type": "dt_control_center"
    },
    "to_entity": {
      "entity_id": "binding.digital-twin.city-ops.0002",
      "entity_type": "dt_host_binding"
    },
    "created_at": "2026-03-23T12:05:15Z",
    "version": 1
  }
]
