[
  {
    "relationship_id": "rel.supplier-beta.supplies.factory-acme-dallas",
    "relationship_type": "supplies",
    "from_entity": {
      "entity_id": "supplier.beta",
      "entity_type": "supplier"
    },
    "to_entity": {
      "entity_id": "factory.acme.dallas",
      "entity_type": "factory"
    },
    "attributes": {
      "material": "resin.grade-a",
      "daily_capacity": 900
    },
    "created_at": "2026-03-08T10:10:00Z",
    "version": 1
  },
  {
    "relationship_id": "rel.shipment-88421.destined-for.factory-acme-dallas",
    "relationship_type": "destined_for",
    "from_entity": {
      "entity_id": "shipment.88421",
      "entity_type": "shipment"
    },
    "to_entity": {
      "entity_id": "factory.acme.dallas",
      "entity_type": "factory"
    },
    "created_at": "2026-03-08T10:10:00Z",
    "version": 1
  }
]
